{
  "schema_version": "1.0.0",
  "year": 2024,
  "label": "BSI Trendanalyse 2024",
  "status": "active",
  "source": {
    "type": "pdf",
    "title": "BSI Trendanalyse 2024",
    "file": "data/source/trends/2024/raw/20240529_BSI UTA_Auswertung.pdf",
    "extracted_from": "data/source/trends/2024/extracted/trendanalyse_2024.summary.json"
  },
  "display": {
    "theme_color": "#17A2B8",
    "sort_order": 2024,
    "enabled": true,
    "grouping_mode": "ui_focus_groups"
  },
  "clusters": [
    {
      "id": "2024-infra-resilience",
      "label": "Infrastruktur & Resilienz",
      "short_label": "Infra",
      "description": "Infrastruktur-, Betriebs- und Resilienzthemen.",
      "color": "#2F6BFF",
      "order": 1,
      "map_position": {
        "x": 260,
        "y": 210
      }
    },
    {
      "id": "2024-governance-transformation",
      "label": "Governance & Transformation",
      "short_label": "Governance",
      "description": "Governance-, Organisations- und Transformationsfragen.",
      "color": "#8B5CF6",
      "order": 2,
      "map_position": {
        "x": 720,
        "y": 210
      }
    },
    {
      "id": "2024-identity-modern-security",
      "label": "Identität & moderne Sicherheit",
      "short_label": "Identity",
      "description": "Identitäts- und moderne Sicherheitsthemen.",
      "color": "#12B981",
      "order": 3,
      "map_position": {
        "x": 260,
        "y": 560
      }
    },
    {
      "id": "2024-sector-threats",
      "label": "Branchen & Bedrohungen",
      "short_label": "Threats",
      "description": "Branchenbezug und aktuelle Bedrohungslage.",
      "color": "#F59E0B",
      "order": 4,
      "map_position": {
        "x": 720,
        "y": 560
      }
    }
  ],
  "themes": [
    {
      "id": "2024-cloud-outsourcing",
      "cluster_id": "2024-infra-resilience",
      "label": "Auslagerung des IT-Betriebs in die Cloud",
      "short_label": "Cloud-Auslagerung",
      "description": "Auslagerung des IT-Betriebs in Cloud-Dienste, einschließlich Sicherheits- und Abhängigkeitsfragen.",
      "management_summary": "Cloud-Auslagerung bleibt ein zentrales Infrastrukturthema mit Auswirkungen auf Souveränität, Kontrolle und Ausfallsicherheit.",
      "aliases": [
        "Cloud",
        "Cloud-Sicherheit",
        "Auslagerung in Clouddienste"
      ],
      "keywords": [
        "cloud",
        "public cloud",
        "multicloud",
        "iaas",
        "paas",
        "saas",
        "auslagerung",
        "confidential computing"
      ],
      "negative_keywords": [],
      "signals": {
        "tag_hints": [
          "cloud",
          "plattform",
          "betrieb"
        ],
        "target_object_hints": [
          "plattform",
          "service",
          "anwendung"
        ]
      },
      "color": "#2F6BFF",
      "order": 1,
      "enabled": true,
      "map_position": {
        "x": 220,
        "y": 150
      },
      "facets": [
        {
          "id": "dependency",
          "label": "Abhängigkeiten",
          "description": "Abhängigkeiten und Souveränität.",
          "weight": 1.0
        },
        {
          "id": "runtime_protection",
          "label": "Betriebsschutz",
          "description": "Schutz von Betrieb und Verarbeitung.",
          "weight": 1.0
        },
        {
          "id": "availability",
          "label": "Verfügbarkeit",
          "description": "Resilienz und Ausfallsicherheit.",
          "weight": 1.0
        },
        {
          "id": "control",
          "label": "Kontrollierbarkeit",
          "description": "Kontrolle, Nachweisbarkeit und Compliance.",
          "weight": 1.0
        }
      ]
    },
    {
      "id": "2024-security-concepts",
      "cluster_id": "2024-governance-transformation",
      "label": "Sicherheitskonzepte",
      "short_label": "Sicherheitskonzepte",
      "description": "Praktikable und ganzheitliche Sicherheitskonzepte für Betreiber und Informationsverbünde.",
      "management_summary": "Praktikable Sicherheitskonzepte verbinden Governance, Lebenszyklus, Scanbarkeit und Managementsysteme.",
      "aliases": [
        "ISMS",
        "Sicherheitskonzept"
      ],
      "keywords": [
        "sicherheitskonzept",
        "isms",
        "managementsystem",
        "betreiber",
        "lebenszyklus",
        "scan",
        "härtung"
      ],
      "negative_keywords": [],
      "signals": {
        "tag_hints": [
          "governance",
          "management",
          "prozess"
        ],
        "target_object_hints": [
          "organisation",
          "prozess",
          "anwendung"
        ]
      },
      "color": "#8B5CF6",
      "order": 2,
      "enabled": true,
      "map_position": {
        "x": 660,
        "y": 140
      },
      "facets": [
        {
          "id": "governance",
          "label": "Governance",
          "description": "Rollen, Verantwortung und Vorgaben.",
          "weight": 1.0
        },
        {
          "id": "lifecycle",
          "label": "Lebenszyklus",
          "description": "Betrachtung von Beschaffung bis Aussonderung.",
          "weight": 1.0
        },
        {
          "id": "automation",
          "label": "Automatisierbarkeit",
          "description": "Maschinenlesbare Regelungen und Prüfungen.",
          "weight": 1.0
        },
        {
          "id": "integration",
          "label": "Integration",
          "description": "Zusammenspiel von Datenschutz, Geheimschutz und Informationssicherheit.",
          "weight": 1.0
        }
      ]
    },
    {
      "id": "2024-kritis",
      "cluster_id": "2024-infra-resilience",
      "label": "Kritische Infrastrukturen",
      "short_label": "KRITIS",
      "description": "Schutz und Resilienz kritischer Infrastrukturen mit Fokus auf Energie und Wasser.",
      "management_summary": "KRITIS-Schutz verbindet Resilienz, Versorgungssicherheit und Cybersicherheit in besonders sensiblen Domänen.",
      "aliases": [
        "KRITIS",
        "kritische Infrastruktur"
      ],
      "keywords": [
        "kritis",
        "kritische infrastruktur",
        "energie",
        "wasser",
        "versorgung",
        "rechenzentrum",
        "resilienz"
      ],
      "negative_keywords": [],
      "signals": {
        "tag_hints": [
          "kritis",
          "resilienz",
          "versorgung"
        ],
        "target_object_hints": [
          "infrastruktur",
          "netz",
          "rechenzentrum"
        ]
      },
      "color": "#2563EB",
      "order": 3,
      "enabled": true,
      "map_position": {
        "x": 360,
        "y": 260
      },
      "facets": [
        {
          "id": "resilience",
          "label": "Resilienz",
          "description": "Widerstandsfähigkeit und Wiederanlauf.",
          "weight": 1.0
        },
        {
          "id": "sector_focus",
          "label": "Sektorbezug",
          "description": "Fokus auf Energie, Wasser und KRITIS-Dienste.",
          "weight": 1.0
        },
        {
          "id": "attack_scenarios",
          "label": "Angriffsszenarien",
          "description": "Cyber- und physische Angriffe auf KRITIS.",
          "weight": 1.0
        },
        {
          "id": "coordination",
          "label": "Koordination",
          "description": "Zusammenspiel staatlicher und ziviler Akteure.",
          "weight": 1.0
        }
      ]
    },
    {
      "id": "2024-finance-digitalization",
      "cluster_id": "2024-sector-threats",
      "label": "Digitalisierung im Finanzwesen",
      "short_label": "Finanzwesen",
      "description": "Digitale Finanz- und Rechnungsprozesse mit besonderen Vertrauens- und Sicherheitsanforderungen.",
      "management_summary": "Digitale Finanzprozesse erhöhen Effizienz, verschieben aber auch Angriffsflächen und Vertrauensanforderungen.",
      "aliases": [
        "Finanzdigitalisierung"
      ],
      "keywords": [
        "finanzwesen",
        "rechnungsinformationen",
        "belegfluss",
        "bezahlung",
        "rechnungsportal",
        "digitaler euro"
      ],
      "negative_keywords": [],
      "signals": {
        "tag_hints": [
          "finanz",
          "vertrauen",
          "transaktion"
        ],
        "target_object_hints": [
          "anwendung",
          "plattform",
          "dienst"
        ]
      },
      "color": "#F59E0B",
      "order": 4,
      "enabled": true,
      "map_position": {
        "x": 810,
        "y": 450
      },
      "facets": [
        {
          "id": "transactions",
          "label": "Transaktionssicherheit",
          "description": "Sicherheit digitaler Transaktionen und Belegflüsse.",
          "weight": 1.0
        },
        {
          "id": "trust",
          "label": "Vertrauen",
          "description": "Vertrauenswürdige Prozesse und Nachweise.",
          "weight": 1.0
        },
        {
          "id": "platforms",
          "label": "Plattformen",
          "description": "Digitale Austausch- und Portalstrukturen.",
          "weight": 1.0
        },
        {
          "id": "sector_risk",
          "label": "Branchenrisiko",
          "description": "Sektorbezogene Verwundbarkeiten.",
          "weight": 1.0
        }
      ]
    },
    {
      "id": "2024-skills-gap",
      "cluster_id": "2024-governance-transformation",
      "label": "Fachkräftemangel",
      "short_label": "Fachkräftemangel",
      "description": "Mangel an Cybersicherheits-Fachkräften und Bedarf an Ausbildung, Weiterbildung und Übungsumgebungen.",
      "management_summary": "Der Fachkräftemangel wirkt als Querschnittsrisiko auf Umsetzung, Betrieb und Weiterentwicklung von Sicherheit.",
      "aliases": [
        "Skills Gap"
      ],
      "keywords": [
        "fachkräftemangel",
        "ausbildung",
        "weiterbildung",
        "cyber range",
        "curriculum",
        "expertinnen",
        "experten"
      ],
      "negative_keywords": [],
      "signals": {
        "tag_hints": [